{
  "schema_version": 1,
  "meta": {
    "generated_by": "migration/migrate.js",
    "legacy_source": "analysis.html",
    "legacy_commit": "02e5167",
    "as_of": "2026-10-13T13:08:28+09:00",
    "status": "active",
    "note": "推奨取引のみ運用。ユーザー承認カードは1件$100で正式追跡。"
  },
  "system": "recommendations",
  "discovery_runs": [
    {
      "run_id": "rec-legacy-import",
      "started_at": "2026-09-26T06:45:58+09:00",
      "slot": "adhoc",
      "note": "推奨取引：旧RMC（02e5167）からの一括移行用。実際の探索回・探索時刻は記録がない。系統ごとに別の移行用探索回として扱う（他系統と共有しない）"
    },
    {
      "run_id": "rec-20260926-live-trial",
      "started_at": "2026-09-26T21:00:00+09:00",
      "slot": "adhoc",
      "note": "本番即時試走。推奨系統として独立探索。公開Webで当日/翌日カードと市場を確認したが、H2H・直近6〜10・ランキング/レーティング・メンバー/欠場等の必要事前分析を同一試走内で十分に検証できない候補は採用せず。"
    },
    {
      "run_id": "rec-20260926-2258",
      "started_at": "2026-09-26T22:58:00+09:00",
      "slot": "adhoc",
      "note": "独立探索。9/26-27の実カード・市場を再検索。強い市場 фав? 候補を確認したが、必要なH2H全件・直近6〜10・ランキング/レーティング・当日情報の検証が不十分なため新規推奨なし。"
    },
    {
      "run_id": "rec-fulltrial-20260926-2254c",
      "started_at": "2026-09-26T22:54:00+09:00",
      "slot": "adhoc",
      "note": "独立完全探索。Mannarino-ShapovalovをH2H全4件、屋外ハードH2H、直近10、ランキング、当大会直近、オッズまで確認。Shapovalovを正式推奨候補として採用。Rublev-Gastonはランキング差が大きいが直近6がRublev 3-3対Gaston 5-1のため推奨から除外。"
    },
    {
      "run_id": "rec-wide-20260926-2359",
      "started_at": "2026-09-26T23:59:00+09:00",
      "slot": "adhoc",
      "note": "Independent full-scope scan. Master categories built from BET CHANNEL, Casitabi and Yuugado public listings; included mainstream, niche and esports. Checked current/next-day schedules across football, baseball, basketball, tennis, volleyball, handball, hockey, water polo, softball, cricket, table tennis, badminton, squash, darts, snooker, rugby, American football, Aussie rules, cycling, combat sports and esports. Deep-dive disparity examples: China-Kazakhstan W hockey (FIH #4 vs #45; China tournament 13-0,10-0,4-0; Kazakhstan 0-5,0-7,1-4), India-Singapore W hockey (#8 vs #44; India 19-0,17-1,20-1; Singapore lost 0-2 Thailand,0-5 Japan,1-3 Indonesia), Japan-Uzbekistan M volleyball (H2H 1-0 3-0; Japan last5 5-0, Uzbekistan last5 0-5), Qatar-Hong Kong M volleyball (H2H Qatar 2-0; HK last5 0-5). No new formal pick saved because directly verifiable offered odds on the three target sportsbooks were not obtainable from public pages; do not invent odds."
    },
    {
      "run_id": "rec-complete-20260927-0003",
      "started_at": "2026-09-27T00:03:00+09:00",
      "slot": "adhoc",
      "note": "Independent scan from BET CHANNEL/Casitabi/Yuugado category union. Mainstream+niche+esports, current/next-day. Asian Games disparity deep dives included China-Kazakhstan and India-Singapore women's hockey, Japan-Uzbekistan and Qatar-Hong Kong men's volleyball. No new formal pick because directly verified offered price on target books was unavailable; no invented odds."
    },
    {
      "run_id": "rec-coverage-gate-20260927-0021",
      "started_at": "2026-09-27T00:21:00+09:00",
      "slot": "23:00",
      "note": "mechanism test"
    },
    {
      "run_id": "rec-rmc-20260927-bc-202609271444",
      "started_at": "2026-09-27T14:44:07.844+09:00",
      "slot": "12:00",
      "note": "BET CHANNEL最新screening_event_ids 186件をrecommendationsロジックで独立全件一次走査。共通候補プール不使用。"
    },
    {
      "run_id": "rec-rmc-20260927-bc-202609271509-marketcheck",
      "started_at": "2026-09-27T15:09:30+09:00",
      "slot": "12:00",
      "note": "BET CHANNEL screening_event_ids 186件を独立再走査。外部市場クロスチェック追加後の完全再監査。"
    },
    {
      "run_id": "rec-manual-full-v3-20260927-2126",
      "started_at": "2026-09-27T21:26:30+09:00",
      "slot": "adhoc",
      "note": "最新JSTインベントリ全件を独立一次走査。"
    },
    {
      "run_id": "rec-live-coverage-202609282322-3c55df",
      "started_at": "2026-09-28T23:22:14.042+09:00",
      "slot": "adhoc",
      "note": "BET CHANNEL complete union（通常+fixed-odds/eSports）全eventを使うライブcoverage dry-run。候補の最終採否・本番pick追加は行わない。"
    },
    {
      "run_id": "rec-user-approved-20261003",
      "started_at": "2026-10-03T20:55:00+09:00",
      "slot": "adhoc",
      "note": "ユーザー明示指示：RMCへ反映OKを出したカードは正式な推奨取引として登録。前回11件＋今回5件。"
    },
    {
      "run_id": "rec-user-approved-20261004-0953",
      "started_at": "2026-10-04T09:53:00+09:00",
      "slot": "adhoc",
      "note": "ユーザー明示指示によりChelsea Women、SC Magdeburg、Solaryの3件のみを推奨取引として正式採用。各$100。"
    },
    {
      "run_id": "rec-user-approved-20261004-1058",
      "started_at": "2026-10-04T10:58:00+09:00",
      "slot": "adhoc",
      "note": "ユーザー明示指示によりTeam Liquid PHとANK Gamingを推奨取引へ正式追加。各$100。"
    },
    {
      "run_id": "rec-user-approved-20261004-1058b",
      "started_at": "2026-10-04T10:58:00+09:00",
      "slot": "adhoc",
      "note": "ユーザー明示指示によりSaigon Phantomを推奨取引へ正式追加。$100。"
    },
    {
      "run_id": "rec-user-approved-20261004-1114",
      "started_at": "2026-10-04T11:14:00+09:00",
      "slot": "adhoc",
      "note": "ユーザー明示指示により宮崎 vs RB大宮を正式追加。市場はダブルチャンス X2（RB大宮または引き分け）、$100固定。"
    },
    {
      "run_id": "rec-user-approved-20261004-2250",
      "started_at": "2026-10-04T22:50:00+09:00",
      "slot": "adhoc",
      "note": "ユーザー明示指示によりWolves/Gauff/Swiatek/Vitality/JDGの5件を正式推奨へ追加。日本vsニュージーランドは価格未確認のため正式推奨保留。"
    },
    {
      "run_id": "rec-user-approved-20261004-jpn-nzl",
      "started_at": "2026-10-04T22:50:00+09:00",
      "slot": "adhoc",
      "note": "ユーザー明示指示により日本 vs ニュージーランドを正式推奨へ追加。最新1X2オッズ未確認のため価格評価保留。"
    },
    {
      "run_id": "rec-user-approved-20261005-1701",
      "started_at": "2026-10-05T17:01:00+09:00",
      "slot": "adhoc",
      "note": "ユーザー明示指示によりSporting CP handballとVARREL Overwatchを正式推奨へ追加。各$100。"
    },
    {
      "run_id": "rec-grenada-reconcile-20261006",
      "started_at": "2026-10-06T11:42:27+09:00",
      "slot": "adhoc",
      "note": "既存候補の集計漏れをユーザー指示で補完。試合後の新規予測ではない。"
    },
    {
      "run_id": "rec-spirit-cs2-approved-20261006",
      "started_at": "2026-10-06T12:06:16+09:00",
      "slot": "adhoc",
      "note": "ユーザーによるSpiritシリーズ勝利の正式採用。"
    },
    {
      "run_id": "rec-vakifbank-approved-20261006",
      "started_at": "2026-10-06T21:48:42+09:00",
      "slot": "adhoc",
      "note": "VakıfBank勝利をユーザー指定で正式採用。"
    },
    {
      "run_id": "rec-user-wins-20261006-2157",
      "started_at": "2026-10-06T21:57:43+09:00",
      "slot": "adhoc",
      "note": "既存の事前候補をユーザー指示で結果集計へ追加。事後の推奨分析ではない。"
    },
    {
      "run_id": "rec-user-approved-20261007-1739",
      "started_at": "2026-10-07T17:39:30+09:00",
      "slot": "adhoc",
      "note": "KCB・Veszprémを試合前に正式採用。Solary・Minasは既存候補の結果集計登録。"
    },
    {
      "run_id": "rec-user-approved-20261008-1735",
      "started_at": "2026-10-08T17:35:00+09:00",
      "slot": "adhoc",
      "note": "ユーザー指定3カードを正式台帳に登録。正式採用は購入実行の記録ではありません。1件100USD基準。購入オッズ未確認のため利益・累計損益は未確定。"
    },
    {
      "run_id": "rec-user-approved-20261009-2115",
      "started_at": "2026-10-09T21:15:00+09:00",
      "slot": "adhoc",
      "note": "ユーザー指定DEWA–NAVI、Marquette–Georgetownを深掘り後に正式採用。正式採用は購入実行の記録ではありません。1件100USD基準。購入オッズ未確認のため払戻・純利益・EVは未確定。"
    },
    {
      "run_id": "rec-user-approved-20261011-0053",
      "started_at": "2026-10-11T00:53:10+09:00",
      "slot": "adhoc",
      "note": "ユーザー指定で正式採用。1件100USD基準。購入実行の記録ではありません。購入オッズ未確認のため必要勝率・推定勝率・EV・利益額は未確定。"
    },
    {
      "run_id": "rec-user-approved-20261011-1258",
      "started_at": "2026-10-11T12:58:00+09:00",
      "slot": "adhoc",
      "note": "ユーザー指定で正式採用。従来の1件100USD基準で成績追跡。購入実行の記録ではない。購入オッズ・推定勝率・EV・利益額は未確定。"
    },
    {
      "run_id": "rec-user-approved-20261011-vakifbank",
      "started_at": "2026-10-11T13:05:24.553+09:00",
      "slot": "adhoc",
      "note": "ユーザー指定で試合勝者VakıfBankを正式採用。1件100USD基準の成績追跡。購入実行の記録ではない。購入オッズ未確認のため利益額・必要勝率・推定勝率・EVは未確定。"
    },
    {
      "run_id": "rec-user-approved-20261012-1218",
      "started_at": "2026-10-12T12:24:19+09:00",
      "slot": "adhoc",
      "note": "指定2件のH2H・両者直近10・共通相手を再確認。参考価格で概算精算、購入実行ではない。"
    },
    {
      "run_id": "rec-user-approved-20261012-jovic",
      "started_at": "2026-10-12T17:33:28+09:00",
      "slot": "adhoc",
      "note": "ユーザー事前指定の正式履歴追加。対戦変更確認後の登録で無効精算。"
    },
    {
      "run_id": "rec-user-approved-20261013",
      "started_at": "2026-10-13T13:08:28+09:00",
      "slot": "adhoc",
      "note": "指定2件を詳細分析して追加。ガンバDNBの指示を反映。実購入は行わない。"
    }
  ],
  "picks": [
    {
      "id": "rec-legacy-log-barca-rec",
      "system": "recommendations",
      "match_id": "2026-09-26-log-barca",
      "market": "match_1x2",
      "market_label": "プリメーラディビシオン女子・第5節 / 注目：Barcelona",
      "selection": "side_b",
      "selection_label": "Barcelona",
      "market_odds": {
        "text": "公開市場：Barcelona 1.02〜1.05級（直近試合参考）",
        "min": 1.02,
        "max": 1.05,
        "observed_at": null,
        "source": "旧analysis.html"
      },
      "odds_taken": null,
      "stake": 100,
      "discovered_at": null,
      "run_id": "rec-legacy-import",
      "bet_at": null,
      "locked_at": "2026-09-25T21:59:02+09:00",
      "locked": {
        "prob": null,
        "gap_score": 94,
        "confidence": "A",
        "model_version": null,
        "summary": null
      },
      "closing_odds": null,
      "recalculated_reference": [],
      "settlement_override": null,
      "flags": [
        "legacy_import",
        "odds_unverified",
        "duplicate_review"
      ],
      "detail_ref": "detail-log-barca-rec",
      "note": null,
      "legacy": {
        "source": "analysis.html",
        "commit": "02e5167",
        "table": "resultTable",
        "row_index": 0,
        "detail_id": "detail-log-barca-rec",
        "data_ts": "2026-09-26T23:30:00+09:00",
        "sort_at": "2026-09-26T23:30:00+09:00",
        "first_seen_at": "2026-09-25T21:59:02+09:00",
        "first_seen_commit": "5167b44",
        "lock_evidence": "現在の事前値は 5167b44（2026-09-25T21:59:02+09:00）から基準点まで不変。試合開始 2026-09-26T23:30:00+09:00 より前",
        "raw": {